{
  "_meta": {
    "stage": "cover",
    "by": "示例",
    "at": "2026-10-14T06:00:00+08:00"
  },
  "question": {
    "zh": "挪威夏天半夜 12 点，<br>太阳为啥还在天上？",
    "en": "Why is the sun up at midnight in Norway?"
  },
  "answer": "答案要点：地球斜着转，夏天北极圈一直朝着太阳（今日一问照此讲）",
  "photo": {
    "url": "https://upload.wikimedia.org/wikipedia/commons/b/b5/Midnight_sun.jpg",
    "page": "https://commons.wikimedia.org/wiki/File:Midnight_sun.jpg",
    "author": "Yan Zhang",
    "license": "CC BY-SA 3.0",
    "verified": "Commons 页面：挪威北角，2003-06-06 00:44（EXIF）"
  },
  "photo_pos": "32% center",
  "stamp": "📷 00:44 · 挪威北角",
  "asked_by": "",
  "strip": "",
  "crew": [
    "dog:sleepy:200:eyemask",
    "owl:happy:160:sunglasses"
  ],
  "crew_say": "太亮啦，睡不着……",
  "credit": "© Yan Zhang · CC BY-SA 3.0",
  "theme_icon": "🌍",
  "sources": [
    "https://en.wikipedia.org/wiki/Midnight_sun"
  ]
}
